<?xml version = "1.0" ?>
<!DOCTYPE specification SYSTEM "../../specification.dtd">

<specification name="specification4" type="may">
    <negation>
        <conjunction>
            <transition name="split"/>
            <transition name="pseudo"/>
            <transition name="mdp"/>
            <transition name="valider"/>
            <transition name="deconnecter"/>
        </conjunction>
    </negation>
</specification>
