<?xml version = "1.0" ?>
<!DOCTYPE specification SYSTEM "../../specification.dtd">
<specification name="specification1" type="may">
    <disjunction>
        <transition name="T0"/>
        <transition name="T1"/>
        <transition name="T2"/>
        <transition name="T3"/>
        <transition name="T4"/>
        <transition name="T5"/>
        <transition name="T6"/>
        <transition name="T7"/>
        <transition name="T8"/>
        <transition name="T9"/>
        <transition name="T10"/>
        <transition name="T11"/>
    </disjunction>
</specification>
