<?xml version="1.0" encoding="UTF-8"?>
<!DOCTYPE specification SYSTEM "../../specification.dtd">

<specification type="may" name="mail2">
    <conjunction>
        <transition name="split"/>
        <transition name="pseudo"/>
        <transition name="mdp"/>
        <transition name="valider"/>
        <disjunction>
            <negation>
                <transition name="consulter"/>
            </negation>
            <transition name="consulter"/>
        </disjunction>
        <transition name="deconnecter"/>
    </conjunction>
</specification>