<?xml version = "1.0" ?>
<!DOCTYPE specification SYSTEM "../../specification.dtd">

<!-- and[split, not[or[pseudo, mdp]], or[pseudo, valider, and[not[valider], consulter]]] -->

<specification name="specification1" type="must">
    <conjunction>
        <transition name="split"/>
        <negation>
            <disjunction>
                <transition name="pseudo"/>
                <transition name="mdp"/>
            </disjunction>
        </negation>
        <disjunction>
            <transition name="pseudo"/>
            <transition name="valider"/>
            <conjunction>
                <negation>
                    <transition name="valider"/>
                </negation>
                <transition name="consulter"/>
            </conjunction>
        </disjunction>
        <transition name="split"/>
        <negation>
            <disjunction>
                <transition name="pseudo"/>
                <transition name="mdp"/>
            </disjunction>
        </negation>
        <disjunction>
            <transition name="pseudo"/>
            <transition name="valider"/>
            <conjunction>
                <negation>
                    <transition name="valider"/>
                </negation>
                <transition name="consulter"/>
            </conjunction>
        </disjunction>
        <transition name="split"/>
        <negation>
            <disjunction>
                <transition name="pseudo"/>
                <transition name="mdp"/>
            </disjunction>
        </negation>
        <disjunction>
            <transition name="pseudo"/>
            <transition name="valider"/>
            <conjunction>
                <negation>
                    <transition name="valider"/>
                </negation>
                <transition name="consulter"/>
            </conjunction>
        </disjunction>
        <transition name="split"/>
        <negation>
            <disjunction>
                <transition name="pseudo"/>
                <transition name="mdp"/>
            </disjunction>
        </negation>
        <disjunction>
            <transition name="pseudo"/>
            <transition name="valider"/>
            <conjunction>
                <negation>
                    <transition name="valider"/>
                </negation>
                <transition name="consulter"/>
            </conjunction>
        </disjunction>
        <transition name="split"/>
        <negation>
            <disjunction>
                <transition name="pseudo"/>
                <transition name="mdp"/>
            </disjunction>
        </negation>
        <disjunction>
            <transition name="pseudo"/>
            <transition name="valider"/>
            <conjunction>
                <negation>
                    <transition name="valider"/>
                </negation>
                <transition name="consulter"/>
            </conjunction>
        </disjunction>
        <transition name="split"/>
        <negation>
            <disjunction>
                <transition name="pseudo"/>
                <transition name="mdp"/>
            </disjunction>
        </negation>
        <disjunction>
            <transition name="pseudo"/>
            <transition name="valider"/>
            <conjunction>
                <negation>
                    <transition name="valider"/>
                </negation>
                <transition name="consulter"/>
            </conjunction>
        </disjunction>
    </conjunction>
</specification>
